{
  "$schema": "https://json-schema.org/draft/2020-12/schema",
  "title": "PokeforgeNpcMemory",
  "type": "object",
  "required": [
    "npc_id",
    "player_id",
    "relationship",
    "events"
  ],
  "properties": {
    "npc_id": {
      "type": "string"
    },
    "player_id": {
      "type": "string"
    },
    "relationship": {
      "type": "object"
    },
    "events": {
      "type": "array",
      "items": {
        "type": "object"
      }
    }
  }
}